"Marca temporal";"Profundidad de estudio";"Facilidad de consulta";"Calidad global";"Su valoración general de la obra";"Nombre y Apellidos";"Profesión";"¿ Nos da su autorización para publicar su nombre y apellidos, profesión y el texto de su comentario en nuestra web ?"
10/22/2010 11:51:23;4;5;5;"Excelente para una";"César Ramos Onís";"Abogado";"Sí, doy mi autorización"
10/22/2010 11:57:46;3;4;3;"Correcta. Es un compendio estimable de los procedimientos judiciales en todas las jurisdicciones. Podría ser más profundo, pero no hay que olvidar que es un memento y que, como tal,cumple con solvencia su finalidad de resolver las dudas más comunes y generales.";"GONZALO ANDRES EULOGIO LLORENS";"ABOGADO";"Sí, doy mi autorización"
10/22/2010 13:54:03;5;5;5;"Clara y eminentemente práctica";"Juan Octavio Rodriguez Cabrera";"Funcionario";"Sí, doy mi autorización"
10/22/2010 13:42:20;4;4;5;" MANEJO SENCILLO Y MUY ÚTIL";"MARIA ESTRELLA TORIBIO MALDONADO";"ABOGADA";"Sí, doy mi autorización"
10/22/2010 15:05:15;4;3;4;"me parece muy buena obra aunque necesitaria un indice y estar estructurada por articulos";"miguel lemus ortega";"abogado";"Sí, doy mi autorización"
10/25/2010 10:49:17;4;4;5;"una obra en la que encuentro soluciones a mis dudas";"Víctor Abelleira Argibay";"Abogado";"Sí, doy mi autorización"
